{
  "$schema": "https://json-schema.org/draft/2020-12/schema",
  "$id": "modeling/elastic-net-artifact.schema.json",
  "title": "Offline P1 Elastic Net artifact",
  "type": "object",
  "additionalProperties": false,
  "required": ["schema_version", "status", "price_line", "model_type", "random_seed", "input_snapshot_paths", "input_snapshot_sha256", "training", "feature_schema", "prediction_contract", "rejected_rows", "limitations", "artifact"],
  "properties": {
    "schema_version": {"const": "3.1-p1"},
    "status": {"enum": ["trained", "insufficient_training_data", "dependency_unavailable", "training_failed"]},
    "price_line": {"enum": ["normal_listing", "urgent_sale"]},
    "model_type": {"const": "elastic_net"},
    "random_seed": {"type": "integer"},
    "input_snapshot_paths": {"type": "array", "minItems": 1, "items": {"type": "string", "pattern": "^[^\\\\]+(?:/[^\\\\]+)*$"}, "uniqueItems": true},
    "input_snapshot_sha256": {"type": "string", "pattern": "^[a-f0-9]{64}$"},
    "training": {"type": "object", "required": ["eligible_rows", "minimum_rows", "feature_group_count", "outer_cv_mae"], "properties": {"eligible_rows": {"type": "integer", "minimum": 0}, "minimum_rows": {"type": "integer", "minimum": 100}, "feature_group_count": {"type": "integer", "minimum": 0}, "outer_cv_mae": {"type": ["number", "null"], "minimum": 0}}},
    "feature_schema": {"type": "object"},
    "prediction_contract": {"type": "object"},
    "rejected_rows": {"type": "array"},
    "limitations": {"type": "array", "items": {"type": "string"}},
    "artifact": {"type": ["object", "null"]}
  }
}
